target,text
1,drinking beer eat bagel bite emily
-1,d workmy second job suck first also mango
-1,usually move room nothing ever get upgraded
-1,sister may kidney infection pray 4 her
-1,smoke cig shower bed work tomorrow 8301 little baby turn 2 saturday baby anymore
-1,hat today life right
-1,know talk krispy kremes today give crave krispy kreme near you
1,welcome twitter babe know meanstill try figure
1,lol no topdocs blog
-1,big red like red truck her name cherry die block crack 36 month left lol
1,hey welcome 2 twitter lols
1,whoa look that last update 50th happy this 51st lolx peace
-1,head wk want toid rather home
1,good day
-1,think you family friend glad okay black day italy people kill
-1,dad birthday tonightwish back australia
-1,yeah thats wat hear thank youi wrong
1,red wing win picked tux im excite tomorrow im tire im goin bed
1,toattyl agree think kinda cute
-1,hop really big thunderstorm end rumble
-1,mom burst tear phone aunt good
-1,oh yea sorry couldnt go amy stole computer
1,well that get 80 today
1,welcome niley supporter right
-1,sad singlewho want friend
1,also go zoo tommrow im well excite gonna go meerkat compare
-1,know anymore love way one didnt work advice anyone
1,maybe make girl afternoon tea sometime ok would like that luvthetea coffee pepsi cola nightgirl
1,hehe yh man
1,finish dn angel two day
-1,worrrrrk attempt grown thing blow
1,lolll june 9th
1,great day today mmm taco bell
-1,wanna one but pay
1,worry tweet awesome stuff happy pas
1,sign lease sooo excite one bedroom downtown wish away summer though
1,reward punishment
-1,whoever invent twitter well job smh
1,get teriyaki chix ready fire shall bring now 8 hour old malasadas dessert
-1,awww man oh well
1,fab eh feel free come along preep 4 chat drink luigis tomorrow
-1,get play half game hockey start pour sand turf wasnt playable enough continue
-1,woke upsick hat life atm
-1,beautiful last goodbye
-1,come newcastle
-1,i miss friend
-1,ok soooo bore wait ge picked up
1,back interview go alright
-1,today soup fail need hunt provision
1,leave pick scott work
1,thank you
1,im good follw me
-1,really disappointed
-1,workworkwork
-1,think there something wrong nelson he really angry quiet
-1,myweakness his name bobby
-1,therez go
-1,want wine
-1,im freak depressed knew would happen still
-1,lounge exam hall im sad
1,haha love aimeeeeeee
1,omg wanna see new halloween movie
1,yes hahaha move lasalle
-1,oh geesh see hate direct tv rain guess signal mean tv ugggh
-1,last day school today
-1,forecast say go rain today
-1,garden cant believe school gorgeous weather
-1,come hold me
1,thatd much appreciate need see guy again way
-1,arrgh hate songgg
1,use record podcasts thanks
-1,shhhppank berry much too miss grey goose
-1,ankle swollen
-1,start early brain hurt
1,funky chick call megan
-1,yes uplift stuff never sell piano
1,seem much fun
1,download movie aisha tyler lit live fillmore cool movie
1,jerry seinfelds standup awesome anyone make cry laugh pick iphones twitter coffee 10 min pro
-1,burn
1,yeah one faves still give goosebump see great player hala madrid
1,paris
-1,feel left apple buz iphone 3g s sniffle
1,im think champagne pay moneybag
1,ill shot tequila smook cheer
-1,tummy box broken
1,damn budget hey think many coral way price day honest gem ive get picked steal
-1,squarespace get iphone
1,plus one zipper dress one nefertiti necklace im do tebet
1,rain cool walk peaceful hear drizzle calm mind
1,glad dance big achievement actually strive accomplishment w life
1,thats
1,lol bradie friend told tell u ur hott spunk lol
1,video funny guy watch hahaha
-1,im sorry miss much want know be
1,work bought signing language booktime ready nerd
1,hey you
-1,call know scar scar me
-1,im bore watch big brother bad
1,hey girl think today hope youre well miss you
-1,temp 102 3 hour lateri call in im hurt everywhere
1,costa mesa speedway tonight 500ccs alcohol fuel beverage brake lot crash tonight plus harley night
1,go sunset grill
-1,starbucks darlingness bus 2 hr
1,tonight beach party rue 13 im dj blast ton sod sand club need there
-1,uuhhg jjust fell facce thanks amber
1,bowling soup write song
1,actually wonder thing son tyler come home today
-1,back atlanta la dreary awful whole time
1,cool wisp 12 feature magclouds home page
-1,point convertible may 415 horsepower visor suck as take back immediately
-1,homework need help
-1,än sã¡ng xong mæ°a táº§m tã£ äáº¿n bã¢y giï¿½ váº«n chæ°a ngá»t cã²n sáº¥m äã¹ng äã¹ng nã y hï¿½ng bã©t káº¿ hoáº¡ch äi chæ¡i rá»«ng quá»c gia vã hang äá»ng sã¡ng nay
1,hot dog chipsi love summertime lunch
1,s stuff always well anyones
-1,broke new mcfly cover clumsy me felt hand lucky cd it
-1,still vacuum
-1,update work problem inbetween keyboard chair
1,hmmm wear today polka dot skirt stud sandal
-1,precious dog catarata
-1,go houston
-1,about live near lol sun fun wend
1,say life give hundred reason cry show life thousand reason smile
1,pastor malcoms heart connect god translate prayer closely link pray
1,raincitylady also gift allergy medicine thankful
-1,im totally cry cant curl hair
1,awesomeness listen mix jonasbros nsync 98 degree love it
1,lmao good good
-1,hate
1,floor next year
1,star trek guy babe go space battle alien win come home story every star trek and im trekkie
1,line vine traying tommorow 0 awesome
1,welcome parisian photographer arrive twitter hope like it
1,talk tahlia
-1,dont want work early
1,preview thing come
-1,mrng everyone im n class watch video abt terrible aid epidemic
1,hha xx okayyy thee weatherr amazingg againn haha tlk yuu l8r xxx
-1,tryinq warm leqs cold
1,1424
1,legit make dinner tonight chicken stuffed cream cheese pesto blend serve risotto
-1,anyone know f4 be sigh miss
-1,still cant sleep
-1,ask follower follow reach 500000 friday 19th june hysterical win ta louise
1,im sit around watch friend ado he fuck genius ola ola carrrrrramba buuuurn motherfucker
-1,annoyed net bandwidth explode everything slow snail leg
-1,damn hood today see him bet parade hoot watch
-1,many thing today like tan study time wash impossible
1,thanksnow come visit cheer d
-1,shady promoter suck
1,relax rest eveninghad absolute glorious day
1,hahahah gotta give prop good impersonation fun bro
-1,cincy promising prospect
1,love lie today thank god long weekend
-1,im way early today work later
-1,wish closer save yours
-1,really need stop follow news site kind make depressed
1,no leave u look forward tweet one dog bra make almost die laugh
-1,cold rainy day
1,come hannah like old time
-1,airport waitin catch flight back hm da chi everytime go hm somethin bad
1,told story bigomaha call beer mug salesman offering blog ad space etc link it
-1,idk whats wrong fone
1,thank faith pretty trippy 24 hour im start feel human
1,add me
1,haha dude 11 follower woot
1,appointment this head tottenham court road date
-1,get flat tire sittn side road waitn aaa listen howard stern lol
1,billy joel piano man one best business
-1,gmail anyone else problem
-1,stop fly much scare me safe
1,left red balloon killer head uglys joes
1,haha well itll always chuck song me remember played gg pay much attention gg
1,finish rest season 5 hill
1,ah be
1,im sing good thing
1,think so hehehehe
1,marlenes dad awesomely awful
-1,workk feel like shit hate sick
1,seem like accomplish anything except big mess good tho love cleaning cool sunny day
1,im awake still glad bgt get work 115 2 day woop woop
1,wtf think baby bepop next read
-1,lol yeah might get like end sept thats bday dad want get thenpsshhh ya righthaha
-1,wow love me mama
-1,amaze beautiful day become ugly thunderstorm
-1,unexpected horrible news rip david carradine husband talk kung fu day
1,take look half way page
1,wow thats lot people hope wonderful time tour around europe
1,omg back igo yard sale bruce truck get kayak w everything 50 cool stuff back more
-1,sad day f1
1,pad se eew delish
1,good morning im excite get ready show tonight
1,okayi email work email okay rough send honest criticism please
1,oh yeah tmorrow marathon good luck d
1,singcham networking mac 630pm sharp pgn skalian mampir ktrnya icol dehh wanna catch britchams worker
-1,hmmthat doesnt sound sogoodi hope wasnt spoil somethingg yuckk
-1,yes exactly that yuck think would maybe thrown little bit id see that
-1,still chance listen shall make time week
1,get everything ready jerseythen off
1,slow jammmms yay luau saturday
-1,almost do go home take med think voice way door
1,love news peep get personal well
1,wake in like 2 hour now want send something wake to love you good luck school
-1,last meeting semester week
1,village becca nikki hannah
-1,record poppin right now nice outside
1,long fun day
1,u ready final day yay get ya paint scrub on set booze chill let paint facade white
1,nothing watch tt work 1130 want get bed
1,lucky best shoppin place ever
-1,ok go watch me work crooner show
1,get 100 follower day use add everyone train pay vip
-1,bruise arch foot land primo
1,rain im mood blogging
1,rain pour old man snore
-1,thats shame
1,zombie son drew
1,ooooh im go miss little eighth grader lmao theyre cute xd
-1,ugh still headache hopefully go away son
1,know good stuff
-1,well
1,loveee take nappss tooo especially schooll lovvvveee u thomas 3333 ur soo beautifull lmaooo
-1,squarespace im go win one i
-1,goodwood training last might thought 10 year young hurt
1,too stop notification gonna get heart too
1,window open air drop local owl start up sweet yet annoy
1,hey darling nice see smiley face hehe
-1,hopefully wait credit see anything wasnt
1,thank share pop
-1,mate complain like new v want back hmmmm want suffer v instead happy v
-1,realize could vote marty 7 email account
1,result new version jquery plugin work dont bug hunt helpful
1,past well almost least since 10 year old take care yourself
1,best mood ever go see 3d super pumped that
1,ghostbusters fan really follow 2009 ghostbusters 25th anniversary
-1,resent that
1,listen that love song 3
-1,guess get dress go payroll blahhh blahh blahh
-1,im tire suddenly think cover shift today dumb idea
1,jillians foot need restrain order tanneralso fix ed reid whoever picked jilli
1,thank give miley shout me mean alot ill keep voting you keep get others vote too
-1,im bugger 82km walk home jump bathroom window
-1,last day placement sad leave everyone
1,get back juniorsenior ridiculousterribleamazing time
1,math exam later look forward it chilin ethan dude atm
1,job great lovin money hat town life xx
1,love you cheer girl bffl member
1,thinkk 7 6 id little 7 u
1,fuck love eunice tan
1,ok point make hurry home
1,time tehuti play senet
1,husband love u pete thought prayer
-1,right really miss bed
-1,stayed late last night
1,hahaha may prick day im picky come return tweetsemails worry
-1,drive crazy hope dealer fix it cant even scroll turn vibrate cant change alarm
-1,to didnt see live miss ltj uk tour potential
1,different car brother drive spaglish spanishenglish xxx
1,country planning go next
1,yeah sometimes forget search mention still find hastag no hmm could add wordcamp tag
-1,weeeh ba fever wala 7asa bshay thani panadol take lo bil uk chan el med wa7da b wa7da
1,good luck mtv movie award
-1,2 day yay gota go hospital 2mo
-1,like peoplewatching like prospect fall five story building
-1,problem advice always perversely compel google exactly instruct avoid
1,chillin tub
1,ooh get follower although honest id get bore follow
-1,sunday go use judiciously still seem lose alaswoe betideand crap
-1,miss be
1,last tuesday may 26th wife give birth beautiful baby girl name zenovia alice maria jacob life good logan
-1,need dumb ol water pump anyway oh do
1,asot400 yes figure hahah every day asot woke 7am thats effort believe
1,happy birthday
1,great girl
1,dork jk know love guy
1,get new cell phone samsung star s5230 like
-1,q fun stayed home
-1,lose 80k poker chip facebooksigh
-1,dr say poor matt
1,thanks give 5 stars11
-1,wish knew something fun go tonight help out
-1,work late recover stomach bug
1,send u email infoat well hook spiffy new theme for free
1,love cover song version sound much well love voice try cry kelly clarkson
1,let revisit tweet get 6am 11pm roll around
1,idk ur nice
-1,noo serious bradley cooper date jennifer aniston
1,shout hayden krebs amaze life make school enjoyable well do krebs
1,goodmorning
1,hmmtake word marsrefers 1 favourite band theyre work new album excite
1,know ur dilliwallah hop stand mumbaikar lobby im planning see again tho
-1,busy week time check email
-1,hubby home tonight im boot computerbastard
1,work damn day go take passport photowoo hoo cruise july baby
1,make myspace profile need friend lol
-1,im sadbiggie get surgery today
1,hi britney love new album thx follow
-1,look pacific ocean central coast california flat wave
1,masa el nour whats day shooooppp s
1,really sore three day d e laugh same
1,thanks m8 one word poem well get creative juice flow
-1,bye arizona return later even
-1,review reading professor art study linguitics give her vacation really over
1,uh yeah 1am person
-1,tummy hurt
-1,morning everyone bad dream woke
1,nice thats awesome lol
1,10 yeaars haha finally delivery guy come yey lts eat yum yum want some
-1,settle cold water pink lemonade powder stuff
1,great amp joke thanks share
-1,scar
-1,before good man sure hv psych go man hehe back tho
1,well im try moment lol
-1,wontt let back on 3
-1,lock self house climb bathroom window get in think may broken thumb process
1,wellcome aboard huw nice see here cheer spain
1,night
-1,sprain ankle even swollen bruising expand side foot dad say pretty bad sprain wth
-1,cant believe
1,andddd cant wait pixelated
-1,hate make projekts sunny summer day
-1,anyone able use stream live video mlb gameday iphone blackout location check fails every time
1,onw followfriday then tweet multilingual willing pack bag request
1,awake eat bootleg crunch berry lol hey like well real one
1,sit front computer bore
1,lol saw funniest photo apparently full video tomorrow
1,first day class wa fun go mall after lol
1,mmm delicious cherry anyone think cherry make best midmorning snack ever hereby remove friend forever
1,fuck manhattan check burger fb
1,pleasure thank
-1,cant sleep like 130 think ima try get sleep neeeed
-1,im bum radio station give away away lucinda williams tix im eligible rather see lucinda ben
1,head back rc tomorrow great vacation
-1,wish could go ut baseball game
-1,crepe o chocolate close
-1,wish another phone charger bad
-1,link go invalid post
-1,wish erols giggle still power cheer up today work
1,yay south park bed
-1,im miss meat puppet concert tonight
1,happy sunday folk whatever today smile it big day
-1,be day discount vacation
-1,back ache usual tire cant sleep usual definitely cuz armt beside
-1,im good kinda tire
1,wait fiance come home
-1,ament eat proper food feel ill
-1,hop work short sweet tonightim exhaust
-1,bachelorette sadddddddd wes still on like jake
1,lol okay kay ill stop unless one time
1,long day big weekend ahead girl
-1,ok day antisocial bore one around chat go out punish
1,haha aivan
1,welcome home asshole 1000000 person understands that good luck yall
1,nice backgroundddddd lmao
-1,man wrong timing fun
-1,currently south carolina ughhh 10hrs go
1,smile
-1,drunk wedding ceremony miss anna
-1,tire go bed almost midnight
1,feel really good great workout tackle sunday chore wait personal assistant assistance
-1,make massively cute swimsuit coverup wish could post pic camera also swimsuit wear it
1,aww nevr met before sweet heart able met three time 2004
1,good morning nurembergsun shin ive get day universitygreat check big breakfast brunch today
-1,home bought 2 salvatore ferragamos incanto shine heard go discontinue
1,get back see up sob like fuck baby amazingly beautiful
-1,g hay naku si judereminded something really piss yesterday dont get start again
-1,nothing be watch e3
-1,overnight party work
-1,nothing
1,toy story 3 teaser
-1,like i know kill me great movie end want more end
1,hmmm leather work
-1,bore
1,oh play djembe thats fabulous idea
-1,ask come bad work
-1,get burnt little bit yest oh well time sleep now twitter friend
1,busy todaylove it move sundaysend u luck love happiness
1,matt savage cought try short pot he roll via never happen sir thanks
1,say like gorgeous 20something
-1,bandwidth limit exceed website
-1,go bed im another one unsure moment
-1,home now chill nackerd fuck still want radio 1 big weekend
-1,im fish
-1,sick damn weather send bee pollen
1,ohh lol woo cant wait till friday bringin drink xx
1,swim today chillin 2 day school me thank god
-1,cant go out home time today
-1,vuelvo cenar en un foster hollywood never again
-1,kellie pickler ellen awesome want hair like hair heavy flat
1,jay def brings energy step in thats expect he 19 amaze he play 6 year so
-1,go completely reorganize apartment tonight amaze sunday night
-1,yep true blood found itunes though
1,lol think lol damn hate sick suppose study cs today instead im cuff as s
-1,uh oh another nice earthquake one 47 orwe lot lately likemore year last 10 year
1,begin wonder tweet dayi know tom reilly buthe look scar
-1,well effed iphone nice know
-1,sleepless night ï¿½ blog archive ï¿½ heart attack
-1,ooh idea what ive lose little red one im turmoil
1,lol
-1,miss quite terribly
-1,jus get bac 4rm dolce shit course i sumbody gotta buy new cam since sum bum bitch stole mine 2nite
1,back hospital keep pray papaw start new job tomorrow exciteddd
1,im jealous hope guy ball great nashville
-1,hack old accountbut cant hack mebut hack follower know want
-1,see saddest thing make realize take life grant
-1,take back band do salsa version message rudie quite right salsa beat
-1,sinus pressure right side faycee isnt suppose happen summmerrr
1,call fugu think
1,holyshitholyshitholyshitholyshit
-1,ew hate jack black bad
-1,try stay awake work eye soooo want close heellllppp
-1,nope
-1,im go try make reading myself day look soooo full thing do sigh
1,u need water intake scientific explanation trust me
-1,short hair miss boyfriend feel like trip america tbh
1,ok arrive adam surprised mother bathrobe lol ill call ruth later
1,thought might show tardisd ipod
1,do
1,good luck you
-1,right work 5 hour go im free xd
-1,hate final regent
-1,hate megavideo much wait 54 minute
1,phone wit
-1,hop justin buy vega ticket today otherwise ill see thunder alone
1,congrats im proud too
1,head dc see mets hourswill access twitter unless dm
-1,feel well work
1,would
1,100th update
-1,luck sleep get as bed go run nothing else do everyones out
1,boring drive tweet it
-1,weird photoshop work not
1,nojust kind bore timeseyes get tire look comp time lol
1,excite baby prek graduation today
1,get house day
-1,today walk like 5 hour straight tire
1,toller soundtrack
-1,think ill home want next week work book forseeable
1,ready tackle list week difficult take day impossible take week
-1,cut sound one them
-1,today super funn idea mall could funn without buying anything patrick drop head
1,bore head still ahd great weekend killarney
1,make keema dear friend crazy indian cooking
1,love danny
1,ty friend yes ur right daughter daughter forever
-1,view office wish outside
1,followfriday maybe im repeat theyre great
1,blowing kissthats you ahahaha woooo
-1,soo lame
1,love song
-1,true way stop it especially country get root cause poverty hard task
1,cathcing old gossip girils love chuck think start fall love dan again
1,every one need help smile
1,amaze night love make smile
1,another pretty summery dress day yay
-1,wanna monumental cupcake nom
1,thanks sarah
-1,much work make get sick
-1,chat w gosh miss much
-1,im watch tv except im
-1,blah thought spending time city metric show guess not disappoint
1,narnia cameron jessica joce
-1,brunch renegade craft fair date cancel
-1,btw call bad cudnt share opinion
1,configure ecipse jython thing go interest
-1,big day sad miss lot wish u good luck
-1,listen music box mariah could still sing
1,drive everyday
1,maui today meeting whirlwind trip
1,well let meet nxt week
-1,happen comp program website suppose give me smh u keep forget
-1,could night bad
-1,go sleep guess
-1,yeeessss let go magic yall get aint even worried bout kobe mean nothin missin babez wish would come home
-1,tidy room soon couldnt bother sad times
-1,wanna see baby aka horse pasture cant get
1,what suck doubt it seriously
-1,want know play piano
-1,watchu think double belly button ring not since madre agree back pierce
1,ill bring sexy back next week
-1,math something cant stand
1,im paâand thats one like
1,david amazon order the whuffie factor arrive april 23
-1,im pretty sure headache go death me
-1,awh win lottery back work tomorrow
1,go boyfriend house today
-1,attack hardware fail one device load balance across web server thanks hang in
-1,web last paragraph shout smcr
1,ha ha real reason now celebration store
-1,new scale say im 283 body fat
1,fun w that
1,happy motherz day
-1,bout get sick flight im feel even bad smh well im head home shower bed
-1,hungry shop open bueno
-1,still load asot400
-1,david carradine
-1,be unlucky quite sunny too
1,know itâ´s worldwide u
1,allotment broke back last week forgot post it
-1,yeah cant could roode horse too
-1,im sorry miss it least okay hug yes online still come
-1,see pic spidey
-1,please miss guy much surprisingly lucky lucy too lol
-1,bad dream last night woke panic someone hold
1,im finally listen chroma absolutely love singer voice perfectly pitch
1,watch federer cry right yeah tennis champ yupp still watch tv xd aint g0nna g0 sleep till 1
-1,go city
-1,want siberian husky
-1,felt touch moment
-1,upset lol
1,problem see 7th
-1,dread week
1,look forward im drupal camp wut abt you
-1,aaaand dont kind line hang clothes
-1,shoot nimmz abb lee may n illana hate costume
1,welcome version 2
-1,kill meee headache
1,nap time wedgewoods today night night would say
-1,ok im really lunch time cold outside
1,run entire race life in torrential downpour dwarf beard last long thought raise â£600 woop woop
1,watch bad english school end tomorrow but 4ever
-1,twitter woot woot day today great back grind tomoz
1,last exam todayy
1,lol think thats time shell announce announcement lol thats long think itll september smile
1,winebachelorettefamilylove p vote nastia
-1,damn go
1,specific like come shortly fangoria webcast david hess from good last house left
1,yay lip ring match
-1,wish could install jdk baseunit work could learn java lunch
1,make twitter account obviously browsing around twitter
1,gonna rest day party nite like vampire
-1,suck math 170 day
1,welcome glad help
1,sheryce blake
1,yes go heaton park today yes stroke squirrel haah
1,ah fing maternity index whats thathelpsjust realize actually read want
-1,cause well never another castrato unless someone make ultimate sacrifice see movie though
-1,ate much itsucks american idol over miss it
1,reading faq im confuse anymore i guess shall give another try
1,awesome ty link theyre gorgeous btw
-1,ok
-1,need job
1,haha thanks miguel told apparently played song juriescrazy
-1,want brendon
-1,thank god there still remodulers like scatter around class econs class come quick least bff
1,movie day today
-1,really really boring day
-1,cant wake morning
1,stand middle intersection look star dk
1,hey niice
-1,get beaten horribly mini golf place 4th 5 get 4th 2 stokes
1,thanks henry gr8 ideawe hope athlete enjoy menu
1,kid sue right
-1,ughhhhhhhhhhhhh tryna play know im deathly afraid cockroach lmao almost drop computer
1,way talk way dance off
1,allison chica want say funny
-1,duh typo error part 2 social networking even room people
-1,im crush could stupid
1,im excite game know never do season ever never
-1,weekend go quickly especially weather lovely
-1,good morning all another weekend bag high me get new tv low still finish unpack
1,idk homework have wont dooo
-1,explains woodman offramp close break 2 suspect robbed union bank riverside woodman sherman oak
-1,omg still sick
-1,but walk away walk away walk away tonight
-1,youï¿½re beautiful girlin austria canï¿½t find beauty love brazilian touch
-1,sad saturday class next sem
1,night night tweet
-1,time charge blackberry lately
1,im go see u2 july 21 amsterdam
-1,hate coursework thought id do last finish university wrong i
1,really
1,damn want keep play marchingsquares weekend call 3 day one that good we
-1,haha zurii think retard miss
1,ahh apparently go well thats good
1,wooo im bore right get home im wide awake sober lovin it
-1,sit car ipod die im gonna anything do
1,im watch burn reading tucked bed girl love
-1,walk gorgeous sunshine far nice work today fb
-1,jealous im
-1,state tues 26 may 2235 checkin flight weds27 may 0005 cost another 280 quid rent money go panic station
1,nope
1,expect lot cutis awwws twitpic here one me one month old pup aw cute
-1,know hid goody ughand btw hot think ill watch 80 tv aka matlock underpantstummy ache
1,ill text lisa get ryan james owen xxx
-1,burnt day also must apologize lax tweet 24 hr
1,wolfeboro area chamber commerce twitter
1,sure haha
1,show may 22nd china club come friday im 19 people far whew grindin threw night goin in
-1,say premier 2 night ice road there hockey 2 watch
-1,nearly time coffee one battle email
-1,im complete stranger anything wrong would hurt cold spoon hot
1,yes work sweet im fun guy
