target,text
-1,oh meant say previous twit you beautiful idea why
1,new blue neon skinny jean yay woooppeee
1,he write 4 3 robert langdon 2 them da vinci code angel demon ad fiction
-1,sigh everything invent already
1,welcome twitter
1,love ur hair look really hot classy time jealous lol x
-1,college 4 1st time year
-1,joã©ã©l donnt feelo gooood justt takin dogey cokeecainee errrgghhhhhh
-1,im school right now lol obsess w twitter x
1,do
1,dont get wht people hate work out like it fun
1,woke
-1,watch devil wear prada im bore beyond belief
-1,feel like he waste much time tonight perhaps last 10 year life god drinking ban yet
-1,still flu
-1,finally back home fun bad thing lose 30 day unlimited metro card
-1,sound yummy ill keep set mind look like fun unfortunately budget right now
1,settle hotel wifi vegetarian course head bristolveganfayre bvf
1,thats thought first start tweet whatever seedo interest
1,yes need twitpic sign page twitter detail set dead easy
1,ella fitzgerlad awwwwwwwwesome good billie holiday billie sure angsty
1,omg excite you cannot wait picture
-1,rain still wait lvatt post today im start think someone steal parcel
-1,arm can vaccination
-1,new polymer change color instantly response external magnetic field soon make man disappear
-1,watch star war episode 1 phantom menace one down five go toobad exam get way marathon view
1,thank ff recommend hope great day fun plan weekend
-1,haha cry guess do
1,heard send on song think voice sound great
-1,true im miss talk
1,aha well enjoy unfortuneatly despise xd
-1,probably fail project
1,yay miss you twitter cant update 3am instead im generally sleep then lol
1,way steffy youre gonna wait big deal anythinggg wait like week eheh
1,sure can and thought dad one told corny joke
1,get judging perform balch spring idol great show excellent
-1,im hop even catherine green fuck yes actually know song
1,homeboy innout come hooter come both
1,thanks
1,good good msn soon afte discuss birthday mum wtf discus
1,thats twitter text
1,get ready event day daughter christen
1,reversible hat go new outfit turn nice noobie milliner
-1,owwwww p rubber band bag foot keep water out
-1,jealous would looove burberry trench course id never able afford one
1,atl gotta b newnew eeesh
1,im excite
-1,traffic
-1,aww lucky theyre expensive big full space for tv show hannah montana arrest development
1,head sat morning market ill wear big floppy hat like localshops1 girl come say hi
1,maria mena make fantastic music
1,course always 1 fan
-1,asnwer question please ipod touch2g do guy work saturday sundaythanks
1,cant wait election
1,note next time use api pay close attention api version number avoid headache
1,know one reason awesome ask could help make day manageable agree laundry
1,wait patiently mom come home donut coffee
1,sure party foot ibiza lol minorca might nice though shall mooch ta
-1,brooke kinsella excellent knife crime documentary bbc one little brother ben die year ago
-1,cant norridge illinois next town mine go see whenever want
1,enjoy stress free afternoon boy
1,n end another wise great nite excuse dream little dream
1,ratherr silly
-1,college shit wish stayed bed
-1,r u monday
1,today really great and none gretchen weiners bye haha
1,voodoo music experience 2009 halloween weekend
-1,never sleep especially mind
-1,madee dinner homee dayy today blah picnic tomorrow mad awesome peoplee loveee himmm â¥â¥â¥â¥â¥ blahh miss em
1,im good r u no know hopefully change
-1,dang win again squarespace
1,case know say try variety face d xd
-1,hmmmmidk love
1,know booskie everywhere be u too thank u reassurance love u
-1,slept thru night couple week now im sooo tire
1,mornin good
1,anyone told today awesome no well youre awesome god bless you awesome dude
1,really want sleep love video much fact beef tonne gravy mash potato
-1,skip awesome party
1,hughlaurie protest song
-1,dude think im get sick
1,daddy cooking french toast yuuuumm
-1,hahah well maybe bad live long yet ew want too skin would wrinkly
1,ahh roof deck share still roof deck yaya
-1,try la february bad next la one right final
-1,safe flight tomorrow bb imy
-1,tsk mate make multi lingual cm told bos fill content take aaaages
-1,cause english internacional way comunication corps dont know speak morse code
1,beach favorite thing night
-1,four day boston survive summer without her
-1,cannot stand im wide awake 4am stress money try eliminate unnecessary bill luck
1,mean thing im old
-1,im bum im go vacation then
1,alright thanks much appreciate
1,shot hydro fuck up
-1,thanks everyone unfortunately nothing do sale speak themselves convince diamond nothing will
1,recession cannes cannes lion entry sink 20 less creative guess
-1,im cold brrr
1,only unemployment would never issue
-1,oh man feel you hate spider make cry too
-1,nan come today brother still school
-1,miss jeep bum ride dread horrid walmart boo
-1,bumdidnt go church watch marley me sob fest put 16yr old dog month ago sad
-1,horse show
1,haha thanks
-1,oh thats sad
1,bodie steel lotus sydney ace im bias check jewellery get ring interested
-1,back night time walk pen fan absolutely exausted stuck work
-1,ate apple yesterday night that throat felt abit funny morning bad backache
1,im member dnt get apply presale tix dnt care sit lol long im gd luck
-1,try get buyin management unit test hard
-1,awwww im gonna miss too send postcard k lol
-1,want black moleskine 12month weekly planner horizontal one
-1,gp internet slow btcl p6
-1,thumb still hurt
-1,spider bit back good morning me
-1,really crave hot food
1,fly jonas brother new favouite song
-1,aw im really sorry suck hope get well you im happy summer weather bad
1,bore shit happens wanna call quits now leeds
1,hang myrtle beach married man
1,thing order lush come in
1,time bed shawn get home game luke bond sleep
1,íë°ë¦¬ out
1,need massage mmmmm
1,colorful woman one wow one day already 14k follower
1,great idea be wish birthday soon hope work out
-1,southern fall minnesota 118 eliminate ncaa tornament lsu play 6pm
-1,pretty cool build outdoor movie theater cheap too sinus infection slowly go away
1,work snore shoresof malibutay
-1,gosh connection really fcked up aah ga b bbm dan browsing
-1,random article generator wikipedia lead to remember play before never get past 1st level
1,hey everyone want say twitter addictive hope ill find cool new people talk to
-1,begin hate saturday work
1,wonder anyone would notice left work day divert phone
-1,well get
-1,happy birthday know mean thing happen
1,ha god im sorry love be grow â«
-1,try backflip
-1,net hme
-1,much read little time
-1,really want go see ai tonight
-1,allll night empty bodyy musta taco anther boring day workkk
-1,want see transformer 2 badly im disappointed get go 2 week
-1,think boring friday b
1,would favourite music video film far one thats you forget
1,oooooh photo cool love pingu
-1,wish case canberra want dog
-1,little milk left house
1,youre jerk official video lovin
-1,yup likely shite well see
1,good morning figure tweet phone
1,hey elva shout malaysia fan
-1,ugegegegeh cant wait part 30 see wont see sad
-1,swift3d crossplatform serial good ah tell month ago try upgrade well price
1,june 8th need hurry eff cause wanna cuddle anyway party party weekend gi grad gonna ridic silly
-1,sat here star computer screen try urge thing absolutely need 1100am meeting
-1,secret life goodbut sad end go bed spanish regent morning ughh
1,great dad parent never miss recital performance game wonderful time
-1,motel room downtown chattanooga tn music dancin bar close
1,share adam boyfriend drake
-1,hey everyone awhile someone make feel want day feel sad lonely
-1,sigh way work already
-1,uhhhhhh last night tell mid night try 2 cheer stunt crazy use 2 b able 2 b4 broke collar bone
1,good morning
-1,girl several people mainly 2 people life
1,look pretty good coffee mine
-1,anyone want synergy hl2ep2 marathon
1,very very shockedbut im happy won
-1,iremember tripod sigh good oldays
1,ok go pink top breakfast si law fiance
1,yeah ive meaning come talk staff important business related stuff
-1,eye feel super heavy gross want delicious breakfast think im get one
1,verizon contract finally up time new cell
1,oh nice day guy thats gotta say
-1,crack bone sound painful hun hope mend soon body pain suck
1,guess ill sin cause technically thats frrreeeeaaakkkky shiznit yuuuupppp
1,thanks hope enjoy dr sheep aardvark base false story
1,i see place four order phone take want one never direct credit
1,almost weekend lot nice plan weekend life good
1,yes remember test come back negative worry sleep tight
-1,know mean ice cream see america muffin fair lol
-1,look mobo revoke geek cred
-1,come see show tonight go amaze cant believe closing
-1,woke reason keep sleep gym time
1,car wash gym do drop truck wash cardio run 14 mile gym lift 1hr run 14 back truck rdy
-1,count
1,toosweet4rnr thank queen cheer lady
1,heart jake ryan
1,watch desperate housewife
-1,family azzuros nan 70th birthday minus poorly
-1,voice tire singingim gonna kill voice tomorrow
1,hope u havin good time girly
1,listen sound rain andbones
1,almost ready release late product
-1,wonder summer go
-1,get headache
-1,forgot tape closer tonight watch season premiere tnttv
1,change interface colour lime see sale rocket
1,check im say anything bad mind thought laff
1,one adult actually need hug didnt wanna ask it give hug
1,yeah u too think delighted weve bust butt
-1,cooli hope channel 10 scrap coz cant afford foxtel anymore
-1,hate cleaning
-1,fav white girl â¥man miss u guy im doin nuthin tho sittin house
1,you think 300th update not woops
1,tune vh1 122pm turn channel wait till 123pm watch
-1,parent go marylanddelware jazz festival jalen home alone slap hand face forget he five
-1,im coursework medium
1,heart paul walker
-1,ugh get call 8 mon preg si law bell palsy last yr tweet it hope go away fast 4 her
1,earlier bought girlfriend issue month lily allen cover good magazine shall subscribe year
-1,missin friend church
1,work so office
1,wow wish
1,miss too hang school
-1,huhu jealous even dad fly tonight
1,awww good luck sorry idea always funny im pretty sure come something
-1,wish diana vickers would follow me
-1,lol lucky mine advertising spam bot
-1,tire head work
1,yo son dont know it gotta take damn leather coat off would literally pas heat exhaustion
-1,good overprice dinner hipster ecocafe sebastopol one around go movie me
-1,wait someone talk
-1,im retard
1,yes want hear get say least lol enteraining hear guy say
-1,wish bournemouth today hows look dorset folk
-1,fuck homework
-1,awww checked website 20 anymore theyre 99 late reyner find pic like
-1,car oil change 32 grocery shopping 30 lunch 12 ice cream 3 redbox 2 officially money
-1,fell resource room one saw really hurt
-1,leave boring park didnt even swing
-1,cant log fire play goat bye im play xbox fly distance
-1,know be
1,get wisdom teeth pull out im like 3 diff drug ughh yes soon
-1,shiiitcant watch morestudio sessionrunning late
-1,bed eatin chicken hmm miss booboo he rotterdam goodnight urbodyy xxo
1,idea make go shirt encourage slightly disturb
-1,fun day yesterday last night suck get sick eww 3 peace
-1,know tom page remember last time here
1,oh good morning btw lol get kayla today want show stuff childhood like dumbo like
1,well
-1,totally agree
-1,whats horrible worry me girl
1,ooooh inpiration bunnyi like thatand sexy back love too want build u
-1,rid downtown work morning without sad temp assignment end mine continue
1,may ask famous ballroom dancer
-1,love god put fix quadcamera already 30 break app
1,sweet repurchase get update thanks
1,hilarious beard cod well give new meaning question
1,talk android version fring need betaster let know
-1,oh there well swoopy might there depends swoopy stuck appointment night
-1,smoke
1,forever rascal flatts 3 watch new moon trailer 3 3
1,madaldal persef 3 when 14 someone cause moral damage refuse elaborate
-1,even all
-1,test hour car get towed need giant cup coffee
-1,sammy lose baby sad day
-1,miss toooo
1,26 degree glasgow played set tennis big serve end win 63
1,happy birthday nelleyhope great day
1,reply 2 follower
-1,im start many hour work
1,goodnight sweetdreams twitter
1,matt nathanson yea be
1,watch snow patrol sip beer life good
-1,tough love boot camp oficially aww next daisy love haha crack upppp
-1,big migrain
1,always lovely chat hl baby sweet hooray
-1,back iron tota fergus jumped sob
-1,love nanny family sad move back denver
1,hopefully get hang twitter use
-1,maybe flea sabotage home server
-1,go end week sadly cheaper stuff stock
-1,cant attend
1,painting come life check new blog post
1,camera tonight yay oh abd die hard definitly fun ride last night
-1,ok compulsive beadsorting morning follow manic phototaking around neighbourhood omg wth jtm fky
-1,would take 20 min get baby sort get busanother 20 min half work stockton wont go get
-1,im go reading book night finish morning
1,yes today sooo much fun let soon beach time hopefully soon
-1,hot damn want gam
-1,hmm twibble wont upload picture
1,wont lose sleep it lol well hmm maybee ready climb bed
-1,lunch almost want go sleep itis hold
-1,virtual whisky may way forward hopefully work
1,why hello boy
-1,upper teeth feel loose flossin 4 first timecant good
-1,hate love
-1,aaaggghhh boyfriend move edmonton thats two provnices away make cccccrrrrrrrrrrrrryyyyyyyyy
-1,im take nap text anything happen
1,follow you follow me too
-1,phone mess
1,awesome whatever work see mom arthritis remedy gin soak raisin
1,dragonball evolution nice able finish watch now haha
-1,damn wish could go ive miss time plan
1,ending know beginning
-1,fix broken thing today trip bq look card you besides shopping
1,yup 176 pool and steam room nice perk
-1,want pringles now
1,health safety always get involve they nowt wrong bit caber toss
1,watch shawn mark quickstep youtube love it great
-1,shrug wonder drop me
-1,cant sleep play chess phoneand think king piece dumbass cant shit fucker
1,get 100 follower day use add everyone train pay vip
1,ill get home tonight dont end early
1,rain already d gah anyway today fun lose threeday headache advil exp 2007 xd thnx gene tnt ban scottys ha
-1,thats smoke fool im tryna quit get clove chew gum turn counterproductive
1,lol u look alone there i lonely song play background
-1,shall revise science oh mann last last gcse unless fail d
1,college jus exciited godchild poppin today hopefully ahh yay
-1,wish good idea next short seem like anything write need motivation
1,ï¿½ï¿½ ë´ ìï¿½ï¿½ï¿½ï¿½ï¿½ï¿½ï¿½ ì¤ì¹´ï¿½ï¿½í ì¤ì¹íëï¿½ï¿½ ë­ì§ ëª°ï¿½ï¿½ ìï¿½ê¹ì§ ì´ï¿½ï¿½ï¿½ ìë¤ì ì¤ì¹´ï¿½ï¿½íë¡ íë©´ ëï¿½ï¿½íê² ìë¬´íí  ì íê° ê°ë¥íê±´ê°ì
1,aww thanks lioneyes bear oh my
1,mimo post much
1,seem lot fun
1,goodnight fan include mei love i hate people like jb bye bye god bless u
1,goooodnight people stalkkk yooooohhh
1,really want ranch sunflower seed
-1,big loser diet prog bit mean tempt cupcake fat sid owen lookeylikey ate 6 yesterday
-1,dad bought disgust ice pop ever dont wanna eat waste dont
1,yayyyy im happy right
-1,thanks sure im gonna miss later
1,indulgent day bread baking reading tea exquisite thornton chocolate
-1,yes good though today
-1,twitter hate me odd reason allow upload decent picture may bite broke twitty
-1,bore go like whole day whaaaa
-1,pass landfillpoor earth
-1,didnt give backk ughh
-1,im go eat pizza
1,ate lunch outside glorious sunshine day like today love work countryside
-1,503 service error sporadic happen now think depends time day sorry
1,come some
-1,mean nothing me still work sat sun take twitter away
-1,yea perimeter 3 min away store change way much close spencer
-1,wish could listen dj awesome pant full coolsauce cant
1,play pool drinking wine classy
1,aw love though
1,star trek v star war difference
1,good morning there
-1,no think lose umbrella fad make karaoke clearlyumbrellasarenotmeantforpubcrawls
-1,im bore someone talk meno one ever reply back anyways
1,wooo one follower one follow meee 6 mwuahaha x
-1,sit class 3 freakin hour cant believe excite
-1,bye che
1,little kid walk past window wear insane squeak shoe annoyingly cute fb
-1,suck affect plan move
-1,amanda go carlos saw music video roller blading weirddd
-1,great song sad true story suicide tom shear father â«
-1,wow story man us 1982 commodore 64 computer i one twitter problem cant open twitpic link
-1,thats suck sorry
1,cannot wait till fridayyyy far there 8 u go premeire hahah
-1,holiday home boring
-1,left eye kill me burn red
1,im allow drive
1,awwww man would rather home family good quality
1,good morning
-1,maui mia 72 hr maybe time really run away hope come home soon
-1,nothing july 4
1,bought new camera
1,sigh satisfied drumsoh well guess 3 month guess practice
1,sleepy time shelbi sweet sleep
1,go grocery shopping dinner still need house cleaning take break earlier play kiddie pool wmy son
1,finish everything need to get anthro project do good productive night goooodnight twiggass3
-1,husband get nap dont
-1,wish nope mean sittin cold room sleep reading
-1,anyone actually reading update im lonely twitter
-1,time rest felt like long day
1,thx retweet hope great saturday
-1,wanna go nickelback hinder papa roach save abel
1,complain sun go away really want stay next 3 month
-1,likewise
1,worry thoughhe fine
-1,wish could send u money
-1,listen news gotten really sad violence hate
-1,reason always find way eff thing mean me honestly say suck
1,go bro wanna spoil surprise
1,lazy rainy sunday afternoon hubby continue nap
-1,look like rain
-1,work get last min stuff way til monday woohoo still bit sleepy fuzzy though xx
-1,try recuperate yesterday festivity nothing work
1,hi iphone
-1,book cabinet bought auction last night beautiful catch come key door lock
1,get amaze destiny wait reveal life ever doubt yourself jai ho
-1,wale ok dance greek shudve bgt glad ovum 1game rugby season ovum
1,cause im prankster sprayed principle hair green
-1,nearly impossible get general admission pit concert chicago stayed night fan presale
-1,mcfly like hungarian fan please answer
-1,take break hand feel broken 20 page left only
1,course may one root bad spell
1,lol baby get bed heheh kid lovely 4 u stick around yes u sooo already
1,love shopping night kid run around bliss
1,idiot say home enough use alot pay speed go free fuck offor dont
-1,lol yes man im sad see coco today spoken week
-1,im worried couple people follow exchange follow more iranelection
-1,hello ya anymore retweet retweet that im hurt
-1,get upset work cu bindz j bully let go duty free shopping
1,im beyond excitedi get new job
-1,always try sing along beirut realise cant sing
-1,go school bad nightmare
-1,im sorry test it
1,hittin tub ben jerry good time
1,tonight asado debug
1,jager bomb dad last night hahaha
-1,wish could come back
1,mother goth get goth help
1,best nyc trip ever thank katielynn
-1,wish play prom
-1,ahhh copa woop cry tonight nearly finish college
1,dark seclude forest little bird chirp light rain fall treetop
-1,tire enjoyin watchin peter n katie wish get back together
1,love taylor life lake like
1,get much do today get car fix go bank im work make monies
1,excite time submit abstract w00t yayar yay emma walwynshepheard rock meg
-1,poor parent major flood today
-1,hungover
-1,tire lunch
1,im good thanks wait young see hospital outpatient long queue still chase record friend
-1,think thats sort motivation need honest
-1,thou
1,new robot
-1,cannot draw face laura please draw jonas face
1,think give kayak bath
-1,want stay home
-1,here problem big bag sugarfree cola bottle gummi worm lose them
-1,woke really sick must tuna ate dinner
-1,l takin kuzco little road tripdont think like much
-1,nothing work lol know ur sister birthday yesterday
-1,ang miss you oh bffl never lmao
-1,wish bf realize great
1,excuse get wii
-1,wheew cant let hair air dry gonna break comb shit try comb perm
-1,athsma attack 2 night
-1,best friend come didnt finish reading brought jack box gooooood
1,seein hangover roomy robyn n nehemiah damone chrissy
-1,and im lazy cook might eat ice cream container blah feel like crap today
1,see iphoneit say bum top awesome bottom use mirror back word 66v1c haha xd
1,look forward see tonight last one v funny hopefully itll good
1,rib shrimp shiner family
-1,ive get sore tummy cool
-1,guess email then site cant help
1,two hour torture
1,chreers bud use it please show u
1,prom intense
-1,watch freaky friday nothing else tv oh well see movie many time
1,bore fourth period review sit best
1,definitely offcampus way offcampus fact starbucks dunwoody place
-1,virus strike
-1,back damn ouch brother close door hand pain
1,happy mother day tweetie
-1,miss car bad
-1,back french france write honk porky back car taker yet
-1,congrats refollowed several time get closer guess win
-1,damn move tampa
1,add name twitter account learn use amaze thing
1,oooooh think band
-1,know assistant
-1,design terrific stage probably fit venue suppose
1,soooo tire work end tuesday believe job hunt since september let know hear job opening
-1,jealous inside dark theater nick j rock fade eggplant shirt write song asjhdkjgh
-1,gotta start build boat go pour rain
1,much american weigh
-1,beautiful really get get bit burnt bad
1,work bye
1,good night â«
-1,stress want prom perfect babe shit aint look good right now
1,others job like available sound like great experience direct message know others
1,home church good stuff nap time yay lol
1,haha awesomeee see friday
-1,hungry hell goin bbq leavin phone home damn near dead
-1,get excite new feature everytime discover dont get uk service outsource
1,go watch week good week off
1,girl baffle me wonder mainly guy friend
1,nght night expect milla pic soon please fab day xxx
-1,awwwww thanks might saturday night pic get photo pas through day job prevents whole weekend
1,im go shower now seeya
-1,totally would however locationally challenged
1,sunset atlanta absolutely awesome tonight good weekend too do get ride big twin some yay
-1,humm want go too go concert today try get money dont
-1,teach math ill big test tomorrow
1,shave head yet
-1,stay rest today
-1,really shame
1,haha gonna good 12pm start 6 finish
1,worry submit resume reddit karma score
-1,never heard iti need itunes money
1,today fun need learn shut though tomorrow fun though
-1,sigh short staffed rest week go hell
-1,find someone wish show rather still demolish cement pond
-1,ii love damien grr ii cant talk like ii use
-1,none pretty grandperspective
1,share tot great convo rumya tonight luv friend endure moment
1,hee yes like that
-1,hey amy anthony si arielle nice meeting u yesterday forgot take pic w u slightly sad lol hope u fun 2nite
-1,hot sleep sf
-1,hey joey thanks follow me saw u aka lounge one time get chance officially meet u tho
1,im counting go get midnight uber excite hear new song
1,listen presentation rainwater harvest system interest
-1,boreeed
1,today surprisingly good daynot im complain anything
1,mine
1,recommend melodie one coolest people ive met twitter intelligent gr
-1,yeah really look forward solstice2009 sick day colleague enjoy though
1,vloggercon something like no one care sign except little harsher
1,thanks sleep and nursing day s amaze
-1,sit here keep look phone know im go get text sigh friend online
1,goodnite rob
-1,back vet today eat drink yesterday mom worried now shell let give h20 hand dropperstyle tho
1,im begining pack california woo talk wait last minute 2 day leave
1,u aint lose me im right
-1,dillon go home today
-1,smh damn like that like crib cool im gonna b twitter week cuz shit
-1,really let in
-1,everyone love get swine disease need sacrifice
-1,sore stomach bug aint shift fancy party general social activity alone another night reckon
1,clean big scary machine long night
-1,really want go work
-1,noooo whats wrong
1,aweee thats cute quote like lot favorited
1,gmorning
1,im gonna kick vag pray him
-1,weather shitty cold
-1,arrive inlaws feel like shit wanna
1,spent day bed pass back pain med feel bit well tonight wellrested anyway
-1,bruise rib everything else lake ouch
1,tweet without pester it twice
1,yes that exciteeedd
1,cute bought jaguar ebay thank god turn scam instant buyer remose
1,umm try think response avoids typical hardcore awkwardinappropriateness fail
1,cruise around brad taylor rannon vernon
-1,why
-1,cat put down stupid neighbor ran truck
1,good morning
-1,feel like death cant stop throw up please go home
-1,errr whatta requirement pharmacy bla bla bla tsk
1,ahh feel refresh 95 hour sleep need
1,sit garden captain morgan pineapple juice life good
-1,im awake one else
-1,yay eat again buuut im jealous get chickfila near chickfila 58 mile away wisconsin
-1,try settle yesterday project365 photo task make difficult cold seem acquire
-1,think even possible ie veteran notice new glitch every time
-1,sad really hop go try work out
1,ive already watch 31 movie year huh maybe make year 100 movie 2009 be think
1,watch titanic
1,album great ray gotta get em jade soon even id stay one mate
-1,wooo must study socialstudies xx shiat wednesday already prelim prelim prelim
-1,mmm want sunshine rain cold
