target,text
1,im watch beautiful gf inthe webcam
-1,hope deejae well today bit sore throat last night
1,oh oh oh chapstick oh would kind bring yourmine belt grad night pleasee
1,trampoline funthink average age user 25 nephew get look in
-1,miss someone sooooo much right
-1,thats cool though hold word say hbd something ahhh im it poor me hahah
1,fun matt
1,cata94musicthatâ´s need pleaseee
-1,run 5 hour sleep fuck
1,moon again yay back way biatch
1,thats soon
-1,left mess around think drunk scary though
1,good morning world
-1,think come till 5th bummer luv kirk
-1,want go work well
-1,suppose thats really difficult do especially people close say hurtful thing
-1,workworking late shift today
1,lose final
-1,start work uk game news quiet week expect gleen much internet tube
-1,lab try work im gonna thisafternoon someone cancel
1,hungry soi 12 food think ill go crepe restauant good food
-1,im rage im work 10 hour day people insist point scorcher know shut face
1,prob girl drake incredible listen everydayyy thanks reading
-1,im rock you belong me basicly describes life except mine hasnt happy end
1,heeeeey much watch tv
1,new interest people here go read blog work today hello new people though
1,eat restaurant shop shop helpful
1,make assumption m capable of
1,alright
-1,shite thats good
1,welcome wonderful excite world twitter
-1,feel good
-1,cleaning science binder study exam
-1,learnig bad weather outside
1,sometimes wanna kill her id kill allthetime
-1,thats bummer think friend would call way let know whats go on
1,lol life time velli meant early listen silly girl yes hatin zappos
-1,hmm mine start past day
-1,would like apologize repeat video game live related tweet go stern discussion koodo soon stern
-1,ok take long eeks
-1,hear baby cryingthen hear woman yell be quietshut fuck up r speak kid like this shameful
-1,hw cm mtv duznt show music anymore v c bunch guy n grls argue n bitching abt 1anothr music go
1,thats help with contact shootq genius theyll happy help
-1,update lately sorry
-1,still cant find new iphone
-1,im pray sunny tomorrow need 2 swim ill keep post night thnks 2 fuck insomnia
-1,piss fridge open night milk brekkie
-1,jessica jessicaclaire youâre couple province awayâ¦ vancouver â knoow
-1,cant understand stuff 2nd std hindi textbook
-1,frustrate greenday something new call stopdrop roll hate thing
-1,hungry tire want work
1,know well talk every day yay twitter
1,revise morning finish whole biology section
-1,im jealous fun guy take lot cool pic vids see return
1,bah well im watch firefly
-1,watch the cosby show busty model wash clothessoft porn exist thursdaypayy dayydamn thats tomorrrow
1,pleasure cant mom mother day spread love
-1,burn leg much well
1,day ton fun start 5am now ask well weather friend good night
1,im banking summer im get new car
1,packed weekend begin week love today agendahome depot abbys grad party im gonna miss chick
1,awesome people follower twitter feel special funnt cuz know im special d
1,think might tweetoholic might twitter 12 step program
1,take go green whole new level tcot
1,alrightsee ya later
1,get one end meal savory one sweet vote
-1,thats need thereto represent blackberry
-1,finish gym haas lose thought go win
1,mystery solve finally time
-1,slow day
-1,yet countin down3 hour left
1,yes bad might miss update enjoy watch them xd ill play ts2 meanwhile
-1,think ical broken
1,watch lakers ceeelebration
-1,goddammit know leave fuck friday wouldve stayed dad would let spend night someone house
1,go bed earlyhave early morning meeting w cpa ultra stressful metom least stress person know
-1,ready work hmm tire x
1,depends much party really kid much adult
-1,feel good
-1,work hour get see terminator 4 tonight free trade shift coworker wake 830
-1,someone hate
-1,yes he pass couch
1,saw ari cutest movie ever
1,glad trudge first 60 page anathem pg340its long time since want call sick read
-1,headache
1,completely dishwasher safe except pattern might come off blue coat humour best three cheer viz
-1,toast crumpts found butter
-1,wicked tire today ready relax weekend without
-1,sit home cuz plan tonight cancled tomo make happy ctc txt me
1,oh need nap
-1,wish id chance speak properly today
-1,absolutely boil get factor 50 on must turn orange must look like oompa lumpa left shoulder burnt yesterday
1,boat sell
1,people like slinkies good nothing still bring smile face push flight stair
1,happy birthday hope awesome day
-1,drinkup last night sad miss first cc ever
1,mine 3 intend make 5 tomorrow
1,get new cell phone
1,thanks kelly
1,brother baby shower cant wait nephew born
1,look forward new website
-1,im never gonna leave chair to
-1,official insomnia midnight 300 2 night row now
-1,get tune car nothing chillin mom go home houston without
-1,phone die
1,yay thanks josh
1,happy see part 1000 follower club now haha
1,aww okkaay fun
-1,stomach hurt
1,yes dear love stuff like thank
1,oooffft apprentic final tonight cannot wait yeyyyy
-1,tire slept
1,excellent look forward pic
1,great 3 hour lucky
1,hopefully fremantle cheer
1,wait get glad dindt plan bbq lol xx
1,so whats great bout call wonderful love life god sake wateva
1,hahahahha demi lovato fall stage look youtube
1,haha nah post ask hair dresser
1,tweet fire right
-1,laptop charger broken unless little cricket set home inside overnight typical bad possible time
-1,im good really busy though think might drop see right nowim way home work sosee soon
1,look forward rock guitar hero metallica later m thanks
-1,amber house listen sing actually pretty good singer im surprised
1,unfortunately feel know well enough actually respond last tweet so many joke
-1,tiptop close fuck
1,wheres shout u swedish fan love u know
1,thank autograph kind sir arrive morning
1,thx ash friend seem handle ok tough time call people love lot support he get
1,nikki yu currently follow truly
-1,haha want take picture buu
-1,every time use line splitter little piece dy
-1,ala finger cross sequel
-1,probably not one little meaningless person opinion matter
1,thx follow welcome twitter
1,haahhaahah bet make ton friend lovely table
-1,wifey get whoever wifey
-1,caffeine yet today ive get headache
-1,watch tv super bore
1,would ask me would suggest yes good know ur friend
1,miss stephits today best pressie cash lol
-1,follow bastard brother
1,if song could let down id scream way away you hey could work
1,far east like uk would love
1,ive do fair share yes get rewatch nephew often
-1,dont want go getaway plan anymore rainingand cold
-1,want leave
-1,really nice day gutted bought flip flop yet
-1,nothing do except buffering another jappanesse drama booooored dear looove come back earlier pleeeeaasee
-1,ask magic 8 ball go get anything do today optimistic
-1,aw thats real bummer work though still go
1,freebie keep healthy free kellogg allbran pack follow twitter freebie
1,indeed confirm real need assistance tez
-1,hate im stuck house will feel lonely now
-1,yeah three minute till wada already want go home im high risk contract swine flu least get
-1,reading heaven help u far slightly sad gerard frank mikey bless
1,perfect
-1,lonex site one you
1,watch sport highlight coffee
-1,happen before el sucko
1,time attack possibly rain
-1,try get ahold memy sidekick work turn send new one
1,bbq neighbour yay
-1,tomorrow celebrity day go taylor swift dress cowboy boot field trip
1,shall visit momma tomorrow
1,surprised last night mark show 1130 home thought home
1,go eat babyim make chocolate cake 2day
1,hey brandi u girl u awesoem play gitar
1,soon oregon yo family first
1,juz start tweet long haha cool here
1,first day class ready learn
-1,really miss puppy
-1,photo dissaperedi like twitter
-1,im gonna look ugly dance
1,gross yo ur jus mad cause u cant it
1,past yup lol thankfully
1,ohh beach beautiful day xxx
1,yawn good morning 7 year old son climb bed snuggle best wakeup call ever
-1,get feeling hurt
-1,orthotricyclen lo business
-1,begin fight giant let hope work without get ugly damn telco company ugh
1,watch x file first time year forgot good be nice mulder be
-1,iight gonna miss tonight
-1,lmfao matt emma legend eeergh school today fuck cant bother
1,get work do can new gear up
1,good kept cool
1,hey im let everybody know even tho fav celebrity dont repond back i will love yall
1,small piece world good thanks
-1,finally awake ugh still tire feel well
-1,yes sadly notice change nambu
1,last day expo weekend suppose beautiful
1,talk laptop cant im aim direct message me
-1,home reasses amount ive put morning
-1,find billy bob thornton look alike
1,realize time cheat make win life referee
-1,damn
-1,who make egg there food want some first word big sister say today since move
-1,ok who frame roger rabbit 1am mean time 4pg english paperlol wish luck
1,amen
-1,hope guy come visit indonesia want meet matt
-1,start play warrior again go loremaster raid six week though
1,car rain one amaze sunset life one end rainbow
1,work library help plan conference scan book cant overhead light scan call bat cave
-1,blog sad it say one connect google connect
-1,wanna go stockholm
1,show size
-1,magic balll w 6 second left
-1,suppose go that idk
-1,cï¿½i album artwork nï¿½y ghï¿½ quï¿½
1,nzd climb yay
1,wow last night soooo hilarious much need drunken night lol
1,metal head date tonight wee
-1,charlies angel may jigglefest time one first show woman kick as take name farrah
-1,cat pass away 19982009 im gonna miss fat bastard
-1,get tha showerwide awake help shower b4 u sent melol
-1,mum think take market tomorrow fun would rather go shopping birthday say wed today
1,yeah facetious question watch motogp good morning
-1,sad cant dm
1,4lol math skill great obviously yay cant wait see
-1,tryin figure eveninwhat devil gonna watch tonight good show end season
-1,looong day rainy cold miss podalong yet due rl really need fix problem notalia more
1,luv ya still girlie mean u iz 30 year old shit expect u cook breakfast smile hun
1,you people tweetingbloggingscrobblingvloggingsnoggingjogging make see light
-1,oh welli dident wanna go wayi thiinkwell realy wanna go get forget sence cant
1,star trek epic
-1,today probably annoy day tweet ever sorry fyi cut another finger today elmo stupid ginger
1,man would love go concert worldwide peace madison square sept maybe ill enough it
1,si
-1,moviemisquotes stupid
-1,tfs 2008 sit vm 2gb ram try use 28gb
1,m product beta sp2 know
1,welcome
1,im hungry need get bed wash faceand find food
1,want phone call email
1,free day go help mom decorate garden flower statue lmao hopefully get suntan process
1,lmao angie brown square
1,plus guy arnt dog lover be work isolate roz bloke hang
-1,sick dog day morning
1,heeyyyy
1,forgot mention im dark sidepro communicator hope im still welcome jsticks
-1,woke feel like rubbish
-1,get home bangin as ice cream baskin robbins 1030 ptfo 10 min ago im wide awake
-1,up really good sad sat think grandpa
1,thank watch
1,watch dodgeball haha loove movie goodnight
1,yeh silly shoppingthats need go back work earn money
1,awesome always
-1,nobody around real slow hr far already begin semester break want semester break too
1,love life friend it write night night twitterland bed work be
1,ya lot there fun find them
1,go vacation
1,830am already sick peoplebig one little one real one virtual one include you never
-1,no thats nothing laugh
1,come back home
1,chat aunt ruth facebook hahaha
-1,watch favorite show muneca bravai hate episode
1,make â£50 sell old game
-1,kinda like almost none friend
-1,get pull meeting want lay couch nervous sick race
1,happy make smile
1,perhaps sappy phone call need cheer up
1,guess im signing tonite good one xoxoxo
-1,arghh dont get point homepage nothing
-1,hayfever good
-1,crank music time study final
-1,design job local web base dont web design think time learn cs
1,wonderful weekend hopefully next week greatttt
1,hey joe whats up psi think loco92 suspend miley cant loco92 time
1,heard new album ill check out
-1,look like come phils
1,hellooooo baby girl vega yay come stalk you
1,25 year tetri use love game
1,bought ticket six concert yesterday mean im see twice within three day june awesome
1,well support tweetup good luck radvision 3 fb
1,goodnight sweet tweeter sweet dream cya tomorrow
1,least guy laugh
1,oh cripes twittersphere lo mood today fault men
-1,hate able someone u love even prob anything feel like terrible daughter
1,goodnight people
1,man love easy make spam
1,wheree goo jaja autobahn boreds sometimes landscape beautiful
-1,soooooo phone broken smh im ignore message call cant get
1,do u big clothes u shop baby gap hahaha movie awesome many quote
1,lalala finish watch late night good episode
-1,whop cold sore top lip sore lip feel like fire
1,must get move poor bird doth feedeth least sun good
-1,btw go teach box nerdsmine go floor
1,feel dude
-1,fuck work ahh lebron james nice day
1,chuches
-1,im stupid need find download 1st half
-1,recollection climb wear tutu sing show tune 50 suspect loss
-1,shoot haha wala pa kong celeb sight
1,watch corny movie
-1,oh would love vancouver week nyc much fun
1,love app
1,listen real radio phone think renegade caught today tweet back please
1,mmm waffle bean
-1,dang suck gurl
-1,think twitpic take image down available anymore nekkid wannabe cop bike
1,re senate else would recognize
-1,gah want include cakeeating pic baby birthday gift thank yous target doesnt wallet size online pickup
1,dream dive silfra rift iceland europe america meet
1,moroccan bath time get rid dead skin
-1,im disappointed tbh still think inside source lol
-1,think die little inside stop make tower burger local kfc whateva
-1,god hate science learn theory rachel little grammar checker l
1,tommorrow s birthday
-1,sigh hate make tweet like this cant sleep im think her
-1,whats next big movie transformer gijoe comic book movie
-1,terry wogan eurovision commentary
-1,walk home school drain energy
-1,chance sleep im really happy tday actually get proper sleep last night make change
1,why go come wisconsin visit beloved daughter tomorrow
-1,yukky rainy friday
-1,yeah drop phone need 200 dollar soon
-1,oh man wish knew earlier
1,great day bikin shame office
-1,wish old blackberry would worki miss
-1,night worldhope dont toss turn tonight
-1,hate wanna live ur life bcause donâ´t one
1,hear
1,really hope fan think that think know well now
1,sister love every minute congrats katie justin
1,grad party hop
1,love too mom one too get mad add hahah
-1,woken yet still feel tire feel somehow one like anymore whole world get him
-1,ugh
-1,need sleep 13 hour train journey wait tomorrow back sometime tomorrow maybe wifi train hope
-1,excite lead 8 hr training today last week gettting ready board nkotb cruise
1,thanks follow nessie
-1,someone special left nw today leaf uk tomorrow long week
1,happy star war day may 4th
-1,wish beach friend dont wanna leave town week
1,old world faire son school amaze im glad over hope i mean he get
-1,omg hill over manager ricky romance mtv award wout im stuck dc pack next trip yo suck lol
1,love you
1,game nbc happy
1,im bout watch hitch havnt see
-1,haha p beware though there blob bird poo ewwww
-1,bad day already
1,oh gosh 17 year old son look young 17 year old
-1,im glad land safe soundplanes scare
1,guess sun show time fb
1,thanks mate
-1,ahhh gotta work later tonight wanna
1,heeeey follow pea please please
-1,either resort iplayer watch afternoon tho tivo let down
1,want skype chat u sometime say
-1,tiny laptop arrive parental departure follow playtime o
-1,hope see peace homeland iran
-1,im tire kiddo up sleep mommy
-1,reinstall xampp many password keep forget
1,get ready leave 711 brosi love late night walk heck love walk stay shape
1,haha pete discover one rabbit i suspect ollie ate shoelace one good shoe
1,haha get twidget
-1,yes ive learn control yr tho mean streak im proud of
1,im 100 antireligious blessing necessary actually enjoy tweet youeven religious nut
-1,workalways want know heat stroke feel like s let hope forecast hail thunder storm time
-1,friend left germany 10 day long ten day life
-1,thou try preauction settlement wid she seem pretty determine go da hammer
1,early morning bike work well see go
-1,ugh hair frizzy mess pool oh well least fun
1,always find im irritable im tire maybe good night sleep help thing look well morning prayer
1,cool billy norway home contry know love norway viking3
1,back college camp headache glory god
1,get home church make book cover bible
-1,im stay work till 6 ily
1,hungout mya meja karey wondermilk
-1,yes flash shitty tonight ittakestimetoopenawebpage
-1,late
1,chance one guy upload prince egypt soundtrack me
1,summer right would nice go beach then
-1,mow 6 hate lawn
-1,worry know feel
1,steal heart
1,lol silly need hurt 1 snypes
1,dog cup coffee backyard thats need right now content sigh
1,julia way over let put hole face
-1,o jealous want chinese
1,think today go officially start madi yes nick name also know a asinine daily moment
1,shame im miss big brother coz really get last night
-1,so abdomen
1,goin sleep church tomorrow dm aussi l
1,eat delicious dinner cooked wonderful mother
-1,great weekend city different melbourne fly home tomorrow night
1,pretty love it glass make look sopphisticated smarticle w
1,otw mall need buy swimsuit go holiday
-1,hiya bit achy today otherwise good sorry didnt sleep co ur worry
-1,want go cant right now suck sick also suck any1 age hang city
-1,fed get game order cancel maybe shld look preowned one instead
-1,awe
1,sun shine soon lot kiss too safe stay happy
1,yeah email addy awesome thank you thank
-1,today hunnys bday awful day celebrate rain rain go away
-1,u meanie meanie btw ive add ur plurk hihi
1,im sure go successful career keep
-1,iono
-1,way palo alto stayin barstow tonight miss everyone way much
-1,work pain spine hip foot tough do
-1,tell
1,problem
-1,argh tweetdeck crashed 5 time within 10 min already tweet automatically mark read view
-1,make make twitter account
1,good morning ivy hope enjoyable day today
-1,shopping do laundry in let excitment start iron
1,another day work boredomwait thing
-1,im use messenger now probably start use facebook tomorrow anyone care ive go 5 day no
-1,shave beard last nightrealized shave much one side irritate piss
-1,3 half hour til arrive london lose
1,packed ready christchurch nz come
-1,upset idid get see bestfrienddd tim birthday
1,12seconds holy light
1,60 beautiful logo design tutorial resource wel nice
1,thank you ill see find review
1,im good thanks glad hear be too must say ive miss well fun lust alone
-1,ugh austin friend see transformer tonight without
1,problem im check out myself
-1,stuff range wmn smallmedium go thru closet yet im semipack rat lol
1,im work too 16
1,bnp thrive apathy immigration concern also lighter note far away posh could hope
-1,want wake morning least finally time even relax
-1,shitty weather
1,itâs shower time beauty rest
-1,today go beachthe sun good body white
-1,cant sleep dont deserve n know
1,tortillos manialove chili flavor
-1,feel good
1,hang wit family kinda boredd reading eclipse miss godfather
-1,three call today advanced wireless two redos
-1,hangover suck gonna go shower
-1,hmm think im due twitter im bad mood feel like sleep
-1,available area
1,shoulder im happy see
1,love sun much great day
1,twitter wrong
-1,twitter act up im see response
1,mermaid night fun thanks
1,nice relaxed sunday chillin around house
-1,economics midterm paper tomorrow ive cover like 5 everything haha sigh sad oh
-1,plan go shakespeare park tonight end last sunday thought go father day weekend
1,ive get feelingthat tonight gonna good night
-1,day 5 stay bed try sleep illness off fun time
-1,hate sister insist im go change like something hate today suck
1,thank retweet much appreciate
-1,103 baby woot woot do project friday it
-1,im sad
-1,great weekend back reality think im major case monday
1,there 40 lcd en route mi casa today finally get rid rynos 5000lb tv ugly z stand
1,sound like something do im try get webpage finally im go 2 ad every1 link etc
-1,go bed
1,listen show lenka love
1,big reveal review come 20 cant wait see everyone do changeupla
-1,finish halo war
-1,umm sit traffic 4 half hour move like 12 mile
-1,thats okaaaay bet gorgeous too look amaze anything poor dress
1,god try ot make jealous btw like new profile pic
-1,ruin good suit ball
1,ouside nice look tough nice
-1,me id miss sean
1,nice acoustic version well do pixie â«
-1,learn u take bark tree die also learn whip cream angel food cake
-1,ugh cant sleep guess ill surf tha web
1,hmmm stay computer go homework think ill stay computer
1,back band practice im temporarily deaf left ear fml hey get red lobster sall good
1,shall listen later
-1,dream
-1,oh no miss hairband
1,thats good healthy person you
1,get 100 follower day use add everyone train pay vip
-1,take insense break outside cause cant light inside
1,happy free comic book day everyone go get mine
1,hope guy show gameplay video e3 year
-1,glad enjoy it wish bingofaces instead though
-1,want ne bff sorry
1,sigh know want tut tut cant
1,yay congrats
-1,arrive dubai im exhaust th weather glorious stay burj al arab amaze 4 day
1,amazinggg played carpathia new sink me sound great energy amaze
1,1 birthday 2 fly italyin order
-1,cant believe year
1,smile language world everyone know
-1,aww im sorry feel happy cash cash come back columbia maybe cheer bit
-1,reallly wanna go back age till next one unless get pub invite lolz
1,true dat u betta dat luv ya chica
-1,stuff like im glad live alone
-1,huge con
1,hey hows do reading blog best talk
1,music soul right nowand ameoba
1,6 day til birthday
-1,little old lady gonna homeless
-1,do sad sad he favorite character grey peterfacinelli hahaha
-1,late hit snooze button many time
-1,good morning hope everyone enjoys show week 4 me mine would tomorrow oh well hopefully reschedule
1,awesomes
-1,r today boooooooo im sad see since thursday
1,come dude suburb virtually same clearly mature one
-1,reload itunes music back onto laptop
-1,everyone either iphone blackberry im stuck razor another year
1,yay
-1,course not still answer exclusivity question anyways
-1,im night owl lol gonna go im drain tonight
-1,feel drink much
1,whyitweet 13 follower
1,jonas brother music report 3 try make perfect
-1,boring thing sunny
1,kid bed except iz start movie wife couch charleston chew sugar baby
-1,oh well hope switch hotel something cheap want help research another place let know
-1,morning all hope good sunday gotta go library study law exam
1,yeah love new leocoontailï¿½z like shin
-1,omg eceryones bed
-1,im try sigh ifeel like wanna cry
1,would well fry pepsi im pepsi drinker coke drinker real good always
1,200th update
1,pasta vegetable french potato delicate lemon mini cake strawberry whip cream
-1,sleep enough always
1,yep thanks mom an actress artist get training today quite early
-1,love venture bros much
-1,apparently get award philosophy chemistry want math
-1,last tweet complain right knee well slam knee onto concrete floor garage ow
1,weird persevere load prop give
-1,need repaint bedroom colorcolors go with black bedroom set oh forgot ugly blue carpet
-1,polyrhythmic arpeggiators great idea many synths limited 16ths maybe sextuplet resolution hand program
-1,uuuhhggggg work
1,pool
1,way home today fun tonight well
1,problem look bloody amaze
-1,go back fuckin bed every1 always busy i feel unwated useless
-1,alllllll byyyyy myyyyyselffffffjust imagine sing walk around store lonely
-1,example bio info seem use twitter much
1,five dollar chucknorris five dollar chucknorris money you
-1,look rather svelt pic normally knowim go stop dig hole
1,would go table waiter save chic saturday afternoon thats
-1,see early teaser trailer toy story 3 eeeeeee psyched even isnt year
-1,work fix
-1,early study
1,im freakin bore too thats im write song haha
-1,300 update really need go home im hungry lol
1,want sometimes go soul friend say awesome
1,hello friend thanks tune yesterday great mix wizard
1,one day gd give mean fulfill mitzvah welcome guest extent want to multiple room please
1,yeeesss thank last perfect
-1,happy
-1,your pic go
1,hug im mean one love nice way
1,lmao get me ill give two point one
1,guy like nick
-1,kid picked 2nd grade 8 day
1,think logo new favourite guy get chelt make pretty thing
1,hey si tweet link
-1,go start new diet routine tomorrow
-1,anji try forget friend atlanta
-1,full service camden gonna self serve way lol
1,tonight ill go helsinki day music
1,wasnt direct soley you want complain tire well lol thanks tip
-1,im try put mind like crack want play fire more
-1,silver prettty
-1,dinner reading classthen nap workmy jason already work
-1,work hardly work someone come visit me kinda lonely
-1,back cairn brisbane temperature much nicer
1,whats head removal sound intrigue saucy
-1,would love vote neither link work copy paste address work either
-1,find another nice jewish boy marry thanks hannah
1,good one
-1,go snap
-1,effin reason pwitter keep reject username password
1,im then left mess get mad make attempt something it
-1,work till 630 feel free come say hello
1,woke already see little window sun shin today get tan plan today
-1,see line call someone hung
1,finally saw wolverine nice
1,thing watchin tv time wine
1,hey sweetie im great tire get do shoot u look sexified
-1,good thing come end
