target,text
-1,roomie call inform someone try break apartment todayawesome
-1,would get 16gb iphone didnt extra 100
-1,stay home boring day
1,voting eu parliament heritage rule danish monarchy spin class feel good myself
1,ooooh sbs2 thats excite relevant medium audience research psbs look forward check
-1,link work
-1,amaze dinner really old girlfriend mine cant believe let five yr slip
-1,aaa yehyehsumpah gk enk abis angkatan kt well good luck test rins
1,listen wonderful music fall slowly asleep
-1,oh thats good
-1,broke qbert record
-1,wish love way need be
1,sunshine planning cycle dune today bbq lovely
-1,false alarm house
-1,hope back get well sunday would hate watch perform sore back
-1,become paranoid
-1,feel bad sad upset get sick little friend month second time month friend mad me
1,get ready schoolhope today happy awesome day
-1,feel like heart go explode all over again
-1,know feel stuck work want go drive enjoy sun
-1,rain yet toad inside unhappy
1,buenos dia saw last night brisenos run bit amaze weekend far miss guy
-1,back work tomorrow miss work money money money
1,correction if go home
1,soooooo whats up whats everybody do whats everybody talk about whats late gossip whats 411
-1,miss jordan hope great time hope enjoy your birthday x
-1,hiyas doin ok yourself awwww sowwy sleep lol niiiiice shame noopy love lol
1,lol slowness hopefully ill get 2c work b4 fallout
1,oh heh pardon ignorance
-1,hmmmm get htc hope
-1,head back toronto today little early though
-1,im really cure norwegian stayed place 18 month ago threw take menu why would anyone that
-1,come bak cousin house beat one song shes 7 it what time it high school musical lols xx beat
-1,sadly late traceycakes get elsewhere still yummy tea w wee wknd
-1,tire
1,forgot adventure playground tate modern mo
1,sit pool san diego 63 degree wait kidlet finish swim im already do
-1,yes engineer decide erase studio hard drive 2 12 month worth work mine upset wordlost
1,amaze date man sweet sincere funnym opinionn provocative adorable downright sexy
1,get ear repierced shopping do mama si
-1,arghh sumone shoot me wanna sleep 1hour hav 4year old snitch annoy me
1,awww thats wonderful
1,come shop mall
1,dog destroy another toy
1,get 100 follower day use add everyone train pay vip
-1,creatively block
1,knoooow take phone hopefully dubai sim still work therei might get brazilian number tho
1,bought new lp today happy purchase also expensive bio lab way go thanks screw over
1,goodmorning
-1,possible saffia could evict big brother 2nite hate already duno s
1,good night kiss hug good stuff
-1,way durban 530 oh hat im morning person
-1,tire
-1,im kind jealous everyone else get go see transformer 2 tonight
1,photo bought new nordstroms yesterday
-1,hard know two reconcile course support side right protest violence disturb
1,welcome back theater guy
-1,found horrid handy man
-1,say one bounz
1,great time
-1,dont send back virginia
-1,prettiest girl sits alone bar
1,sound pretty heavy hope work
-1,oh safina someone brought agameit unfortunately
-1,need luck book ticket irctccoin
-1,wow far good sweet twitter
1,yes be hire enthusiastic individual work u area
1,glad see back wagon warm welcome
1,amaze god make thing work thank you
1,night everyone tomorrow
-1,definitely overprepared overdominant last class spontaneity think foot feel somehow healthier
1,long day yday try play wow eveningnight get metime relax friend online go bed instead
1,finish eat crissyownsu
-1,sigh one down one go honestly suck need ice cream blanket hug friend right
-1,work today tire
-1,serious
1,make twitter account
1,awe too sad cant let get u down keep spirit smile
1,go rehearsal today lot folk show rehearse bit jam fun even ahead
-1,hey phish pwnd phishtube broadcast live
1,bed early finally first time whiiileee goodnight
-1,hey twitter fam ur weekend goin mine sux far bcuz caught cold hate sick
-1,thanks dude im gonna cough food weekend
1,beautiful day
-1,outside get tan on humid
1,near perfect saturday also scallop shellseekers
-1,morning already
-1,shitty day jelly tot give new lease life
-1,laurennnn fave blogger make blog private turquoise string top distraught
-1,still eat doughnut national doughnut day
1,already do many time much sunny day xxx
1,happy mother day ladiesincluding myselfespecially single motherskeep ya head momma
1,whicked witby walk ton good workout wasnt fish n chip
-1,want freddie come see her
1,1 v 100 beta xbox live 1030 excite
-1,no teh sick bad way
1,work second time around im fan already
1,heh theyre uber fantastic cool brown plain top pink cupcake pant yes wear pink
-1,hope zed doesnt take joke seriously 3becouse shes really tiger youshould see back d 3
1,it
-1,sooo hungry wit appite
1,thanks almost push button buy amazonâ¦â¦lol watch show er u off sorry bother u
-1,awww miss home
1,whats pool laziness 2morrow suppose nice im get hair do sunday
1,type au lol im nerdy meant write one character write alternate universe
1,work php mafiawars online rpg game look good
-1,wonder hell work go throw time anyone get spare lucky charm look like may need them
1,oopsthink talk artshow get go too bio statementtrying shortentricky
1,pop overheard curse breath first time life surprise face priceless much impression
1,enjoy sunday morning coffee
1,think show start till 8 time maybe finish short story read bit good even
1,next thursday u suggest l4d ill free 67 onwards
-1,biological anthropology exam tomorrow least do class week 6 week think
1,yep hows day go
-1,well say therell backlash long anyway feel bad asian population though
1,lolol sure find someone give turquoise highlight get another mani pedi aw life
1,ever envious point steves book say need turn movie please
-1,cleveland fan never give hope always end bein let end im even gunna watch final haha idc
-1,sufferingbcos stomachache
1,understand loser pwentz say kill petewentzday
1,cannnn talk use phrase for real hahahahahah
1,hazimov u love
-1,awful cant even find word express sad
-1,cry ok vian
-1,hate rain
1,im sorry question last request upload last version app test italy
-1,last episode scrub really sad
1,im sorry twin love you txtd i love you you dat way say im go hme early yea skip asa love u
-1,get rain go explativie hate use photo pass tell go im bum im
-1,really tire light head get uniform shoe today feel like im another planet ahh bed
1,there gravity hold real really even care
-1,fee good
1,ï¿½ chegay ao mundo twitter
-1,shaun get old thought knew get in realize doesnt
-1,oh no boring day today im go watch tv see ya soon
1,sunderland university magazine journalism level medium study english language business study you
-1,omg graduate thursday last day yesterday ah thrill depress time 3 best friend move
-1,math regent easyyy 2 gooo
-1,lot plus compng nintendo look good clap yet
-1,im girl office somebody cologne smell like celery
1,goin phoenix mercury game get b part fan tunnel hopefully meet sum player watch online peaaaccce
-1,happy today iced coffee
-1,aaah love matilda too always watch catch tv cake scene make feel ill love miss honey
-1,im okay subtle hah never go outside
1,new style year henleys kite jean
-1,thats exactly im feel
1,watch tidbit evangelion 101 yet give chill cant wait watch later
1,nope mother want collect something go with get mcdonalds actually english lit fun
1,post post
1,heheh fresh veggie rock
-1,wish somehow there school tomorrow
1,get sleep
1,yay first new moon trailer finally out
-1,back work online today require
-1,veteran cbs newsman walter cronkite report ill
1,im little kid again nickel arcade joe 2 boy
1,okay work aaaand guy skype chat like every day now lol
-1,pray victim metro crash sad
1,india won
-1,look cant go drive today account rain
1,boston fam get ready go harvard mem church my old stomp ground and weather finallly cooperate
1,ol mcdonalds yay
-1,always feel like wait weekend come around do fly byagain fear end june
1,whew worried reality southern root moment though
1,true love phil wickham
1,thats ok little busier thought id be didnt get chance twitter muchdid u hava great wkend
1,dayton pride weekend hit columbus next two super excite
-1,bought pretty summer clothes whats bet rain week
-1,miss melbs glad see maximise use heater
-1,call silly lady short sht out cant believe handle thing
-1,knee really hurt
-1,disturbia make think indi always happen me
-1,bout go work
-1,7 day without see make 1 weak brianas baby
-1,do her send lazy little minx around here washingsortingfolding weekend still do
1,hey chris
-1,ala sunrise woke right time realise battery rear bike light
1,hey hey
-1,maybe next time cause gotta go sleep go work 4 hour
-1,god knws wats wrong wit prithiv nw
-1,1045 bank holiday monday spend last 30 min fix work issue cant ni bank holiday
1,hah poor fuck
-1,awww poor you hope feel well soon
-1,be
1,tire today what surprise long night work good sleep today good lamb dinner sunshine fantastic
1,problem
-1,really glad decide check result rugby go back bed
-1,go gym todayand go work
1,hehe kind girl
1,oh yey glad land safe sound always postfear im currently sew new goody x
1,go bed now want weekend end perfect
-1,least get go place like that im stuck go minnesota
1,gossip girl katie peter im bore all
1,say smart bro team come fix internet connection yey
1,tonight mission watch 100 top internet video
-1,morning world early take claire work
-1,get ready go shopping think bbq later go happen now pour out
1,im great another wonderfull day sunny caribbean
-1,put bugger grill realize bun bread
1,kid me time fridge told you icecream freezer put defrost
1,get info thks job
-1,walk aimlessly 2 hr hurt foot potentially worsen little toe never felt well wtf hungry rawrr
-1,enjoy act hamlet sit look word fun all entertain point though
1,awesome haircut look awesome haircut also make peaceful
1,happy mother day
1,get ready go spunky town
1,love new background work yayyyyyyy xd
1,hard supportive another poet work good yours
-1,soo tire lot work xoxo
1,really want see that love you sad else
-1,way home now maybe move forever haha could handle rat tail annoy lady im sure could avoid them
1,laser quest wicked
1,ill probably remain single rest life
-1,waitnooo kyle cant go home go entertainment
1,scalia bitch
1,hmmmm sure give another go thanks scott
1,bought seth godins tribe im reading sony reader good life
-1,think point would set filter put straight email junk mail trash folder
-1,knew it p cap small
-1,jst woke bye ate lunchz0r mmm cold sad scar
-1,wow havent tweet age feel left out
1,ill bed mannnnnnnnnn im 10 bad news me im sure survive
1,youi update next part tomorrow
1,lol thats everyone else say im bad
-1,leave me
1,great day kristen
1,change picture answer please iif u like problem
-1,go bed think cold next sunday leave cruise w00t
-1,bitch split beer air force 1 even care
1,go home im exhaust fun
1,say love never physical contact
1,thank new follow today glad aboard
1,time hit road get ready free friday night flick come join u want
1,adventure ensue sorta ate 7 pizza much need downtime
-1,ask jen read tweet say u go tan
1,nibble love bite oh get nap today too awesome napsgood
1,open mr self destruct here amaze
-1,heard david cook brother passing awayso sad rip adam cook
-1,idk imma get shrt notice forgot game today buut imma likely 2 morrow w lauren
1,look like might contender crap day stake start well far hope well
-1,sad
-1,bed get early night shame im tire
1,today baby preschool graduation
-1,track go yet room smell gross one clean mouse pad
-1,laugh want watch terminator salvation
-1,awww thats real shame
1,messy homemade sandwich world lunch today taste awesome tho
1,found local fabric store batik galorewowi might heavencoolangel fabric hee hee
1,send address send contact
-1,ugh hate get cute go
-1,hour before guess tan
-1,didnt want hear answer ouchthat hurt
-1,long day year today downhill
1,goodsex u wakin saturday morning freakin bc u set ur alarm think ur ate hell 2 work smh happen
1,there official sanction spymaster meetup middle dancefloor 330 best breakdance win 50 attack
1,cant believe day go fast15 day left
1,would take dinner day week mr webb
-1,dislike hospital
-1,horrible mood look forward get away while misery
1,sooooo cutteeee adamlambertnews adamlambert adam lambert kris r totally run spoof lol
1,start get excite slinky white less 2 week now
-1,bought wrong dlsr too olympus f14 lens
-1,go get wisdom teeth take
-1,anyone update photowalkingutah google calendar photowalks look like ive miss
1,hahah arizona southern arizona
1,seven deadly sin lust gluttony greed sloth wrath envy pride
1,heheh qualify pretty excite tho
-1,final least 2 more woo
1,be tire morning
1,upload picture
-1,lebanese electionsin word lebanese secterianism best lebanonelections people motiviated hate vote
1,no dolphin as
1,nightie
-1,wiplash never drive
1,do spanish kadys come today
1,wish boozle matt say insane green room instead im hometanya get accident glad shes okay
1,get sims 3 bought collecters edition fiver moreand come â£6 voucher flash drive
-1,disappointed dr kagan nowhere near inspire expect
-1,boy flu
-1,anyone evan taubenfeld delete mine cant find
1,back fabulous trip victoria cruise travel awesome make friend way back quite eventful day vancouver
1,asot400 blizzard feat gï¿½te iselilja the vocal mix im mistaken
-1,lol oo see break 116146you shoulda come didnt see
-1,yes notice yesterday even bother write correction
-1,thank you need pas test first
-1,cant see it america
-1,get mud eye ow
1,lisbon algarve lisbon today prius can go fast need
-1,everybody enjoy weekend me work
1,careful tom hope really broken maybe jammed it always look brightside
1,cleaning room past two hour do yet wish summer mixture season
1,know gonna amaze episode
1,erewhon org crispy brown rice cereal yum good love like rice krispies dangerous cant keep house also gf gfree cgft
1,really guy always want name twitter name website bullshit
1,back burgh sunburn annndeverywhere go see black gold pitt 3
1,u gotta pas hey ttul doib hurrrrr snap crackle n pop lol
-1,ask self thing
1,3 day weekend honey doo list honey honey that yeah good though
-1,im sister room want go back grandperents fly keep attack me
-1,found abuelo aguadilla well
1,home finally relax love comfy couch
-1,babysitting kid babysitting shelter home yesterday sad
-1,ugh dont want chrisy go mean shes yet shes get
1,welcome
1,love tooooo duuudei need make shirt say something cool say
1,sound fun love x
-1,laptop screwy hopefully okay fb
-1,bought dad father day present bit late know lol download xplane wish flight simulator x mac
-1,lol u know cuz go home first wanna go back 2 get stuff u
-1,okay ill try im sorry bad english u dont understand okay doesnt matter
-1,get boil go another bbq today l cinema though get withdrawel symptons watch natm2
-1,go back office start hell work
1,sure could could me
1,good nighti want give nickname im sure bitsy bone wearingi think magnet sexy magnet
-1,rang apple apparently take week ship product china uk bollix it hate wait new toy
-1,clearly new jayz record drop im one know twitterverse heard it
-1,oh gosh thats sooooo long
1,give month two get well shape ill run alongside stopwatch water bottle
1,sit comp browsing home studio
-1,cant work he play game
-1,nightmare someone stole marc jacob
1,ok back write ill lurk
-1,tan cut short
1,thats educator talent
1,bring back sir murryington walker say
-1,sorry ive mia phone fudge miss you hope ur feel well
-1,computer crash back ipod
1,yesterday best day life
-1,nice cant even enjoy
-1,go jersey weekend ill miss cylob
-1,oooh noo gotten drunk last night head hurt story beyond story im sure
1,luv name tripp
-1,gay n stuff model n school class mate hat keep girlie ur amaze xo stefan
-1,ughh neighbor use pressure washer 730am
1,haha sam like 4 m
1,hey haha cameron bad come seminar d nevermind ur hairbands lol
1,sit stand walk back straight feel enough air go lung remind not
-1,1 dude work would bang sad state affair
1,lucky hope u know
-1,day full math history realy tire exam
-1,facebook collapse via twitter actually useful fb
-1,suffer date choose also
1,heard kim tonight get sick hope feel well soon
-1,hovertoilet seat alway wet flush spraytoo yukky
1,think complain much vivienne tam have
1,like hike kevin much maybe join guy sometime
-1,bad headache ever sleeeep xx
1,donnie darko best movie ever
1,omg want snicker ice cream mmm sooo good lol
1,know already read duh haha ive watch trailer many time great
-1,emma ogt fight it fake 1 jk
1,watch depeche mode jools holland third time fantastic roll december dublin
1,iv get go bed damn stupid time difference night
-1,woke up miss friend
1,dare nil get offline without say goodbye
-1,wtf florida library rt omfg late work alarm fail
-1,morning guy work today
1,yum yum love quesadillasand wallpaper matter tooo
-1,bad day ever tour u lose internet 2 min blink182 presale floor seat wow wow
-1,hope everybody great time canoe trip sad cant come
-1,waitin 4 si 2 come home frm m8s go 2 sleep lol 0005am n still isnt home xoox
1,get do eatin bowl raisin brand soooo goodnow time catch z favorite pas timesleep
-1,believe get sick happy it
1,also sun eve cinema nearly empty star trek first time ever see st big screen despite 18 year watch
-1,watch episode ghost whisperer jim die
-1,dont want let go sad morning leaf
-1,lose gameee again
-1,great day close visit w friend begin apr 25 sad see end lot good time story though
1,need look whats come line u world change adapt preach christ effectively people
-1,ugh dunno im best mood know allergy meh
-1,get tomorrow
1,yay fixreplies agree w00
-1,need money tree
1,somewhere center
-1,wish dad go summerslam well go go play d im bore tire
1,ear wiggle also major signal insincerity hahahaha
-1,countin sheep cant fall asleep yet tryin hard guessin dha boo slp
1,couple late night week rest day baby arrives november
-1,really terrible jetlag tire sleepy
1,love funeral neocon snl remind tcot
-1,ahh see thats shitty
1,okay im go sleep
1,good luck gareth hope well
-1,ur way tooo far esuper sad
-1,totally favourite burberry perfume someone sugar mamadaddy amazon wishlist
1,get forester instead
-1,lol thought da 1 want 2 rip hair out 4 hr sleep
1,enjoy beautiful sunday
-1,whoa early already woken sun time fit sleep please
-1,hair cant even stay back burnt much
-1,miss
1,stop listen people except me think best
1,add cute baby pic xd
-1,god air france passenger family tragedy
1,get munchies baking cake lol
-1,get cough
-1,dreadinggggg wake 5am work 6
-1,mine glitch nongenetic birth defect found 20 wks ultrasound induce 4 day wepidural
1,slip n slide hug dry teacher yearbookshoe signing awesome holybejesuswearereallydoneatstalberts lol
-1,im go
-1,sims 3 game run slow
1,saw hannah montana movieamazingg im currently inspire
1,haha thank ui would happy haha ill keep dream
1,re ww join week ago third time
1,need another coffee
-1,ill batch
-1,get ready go slave away gap
1,cant wait new moon preview amaze taylor lautner shirtless omg
1,thanks retweets
-1,work cold bum
1,figure different time zone strong point
-1,oh man thats seriously fuck up
1,colly
-1,asterisk meetme like me want documentation implement either
1,im get sleepy im hooked twitter now great
-1,found small alien crawl arm wtf thing hope disease
-1,sorry boy fail keep streak alive sluggish discombobulate hope fare well ohio today
1,palm pre house charge now glad rain play day
1,know use word awesome instead
1,bust im weak
1,platinum wedding
-1,read night apparently
-1,wow jealous youu ahhh get go inside stuff bet deffinitly epice
1,happy monday everyone whatever today smile it day
1,say hi denise promise reply
-1,yeahduck prejudice big problem among primate
1,time kidnap wife knock out next thing knew lie semiconscious tatami mat floor
1,uh oh theyre circle like vulture time pull something special cellar
-1,rain rain go away
1,sorry lol 752
-1,wish time machine turn back clock wouldnt sad
-1,really cant do work today wanna crawl back bed
1,ill return favour 8 love song x
1,thought drag hell funny fuck
-1,rrrr dont like tabbed file photoshop c 3
1,glad do always pleasure find one make difference maybe write often
1,young mariah carey house
1,new skinny jean perfect fit freak cute
-1,father day miss daddy wish could home give big hug need hug
-1,dress head town
1,dude thx much arrive 9pm glad know ur betta be leavin 6am
1,totally tire great feel today gonna amaze lot laugh luv u yay
-1,im goin sleep
1,congrats
-1,c nhï¿½ ch ang m
-1,must connection
-1,lol lol lol nerd right cop follow u home think peed little
1,twitpic drinking challenge
1,dont send much haha
-1,like lol
-1,may may fly london tonight
-1,london wont theyso thats good
-1,doro still ill antibiotic dot work hard weekend
-1,look forward overtime week
-1,cant find phone detroit bum lose dare
1,start shock headache earlier today actually really good work due till tuesday sweeet
1,kiss new follower
1,typical cat
-1,sorry guy tweet twitter slow today reason
-1,lolas still hospitaleveryone pray grandma ok
-1,bye need arrange thing hello school
-1,get lose nyc grid also iphone excuse im envious btw love nyc
-1,head feel like bowling ball
1,gym joe finally
1,mal3ab ba7a2 7a2ee2
1,rating restaurant random street rate mine
1,home work la la la
-1,still go recovery process laptop
-1,want home eat chocolate chip cooky constantly twitter
1,hmmm like that lyric
1,lake
1,bad movie movie get numerous award oscar globe award haha clean eye
1,yeah forgot snooze and mute button kiddos belly still work progress
1,sweet ill play uncharted 2 multiplayer beta ps3 tonight
-1,be office
1,oewh veel succes
1,yogurtberry awesomei think well pinkberry haha
1,thanks much post ps22 chorus video talented group kid watch video last night
1,hello fellow twitter im see sexy man cant wait
-1,phone die feel awfulgnight guessi really need new medicine
1,thats mom fav chapterverse
1,still sit sun listen boom boom boom haha never thought would actually like song love
1,u checked website an im gear another hosp visit 2day
1,hurt anyone lol let lady know perfect love
-1,bac house bad there ac
-1,daddy birthday havent even see
1,true
1,rbsutpp not sure originally played think amaze â«
1,yum happy
-1,damn cant believe beverly hill cop 25yrs old reality check remember come out feel old
-1,nooo mitchell davis myspace page get hack
-1,consider get n drive daylesfor market might kill back
-1,walkoff homerun texas win suck asu eliminate
-1,cell phone right really feel like texting call house need me
-1,bad feature available change totally base country choose
-1,miss much sad cant believe he go well pray people know
-1,get ready work good news be close
-1,17 12 yr engagement partner get married family home boston fridayto bad recognize va
-1,c switch schedule im try get zzzs im wide awake sigh
-1,want watch david c david a concert
1,breakfast eggbread yuuuummy wooo hoo sun shin 3
-1,still feel good maybe allergy cold
1,hillo summer me excite next school high school help nah im kid
1,like that go daughter shell love it thanks
1,think ill buy game tomorrow ill find one eh you
-1,im try freak keep call vet check cat im gonna again hate know whats happen
1,hopefully new laptop battery tomorrow friday
-1,watchin wipe out bbc2 pretty rubish reali
-1,neither haha wanna check out though sake see main host single out least
1,awwww big dog good straight substitute
-1,lay bed pretend im go go back bed
-1,feel bad camille war rose
1,thanks much
1,could possibly give link teeth whiten video
-1,nice mother day sad weekend come end
-1,oh goodnessrip james e tritt father travis tritt prayer b u
1,bye guy
1,perhaps ill try write short blog future thanks give idea
1,nopes meet lord shiva
1,know put whiplashprevention collar detainee cuz lawyer hear whiplash mile away tcot
-1,could life find tent bum want see
1,appear name new popcorn contest whats prize
1,home jnf show pretty good
-1,codecamp today car broke
1,chickfila bonus
-1,would be harry wouldnt need
-1,woke nap found drool lip eww
1,firefox extention make behave like vim
-1,wow realize something wierd today gotten single txt message wonder feel lonely
1,gonna write question now ill make answer video tomorrow last minute one
1,call em up love fios happy cablevision free home
-1,up saddest disneypixar movie date
-1,finally back h
1,busy saturday ahead look like great day out
-1,man box radio again make miss
-1,feel sick rain cold 11 degree colder yesterday
-1,itouch o 30 youtube app work anyone else problem
1,mmm pancit ensaymada today ube well let go see drag hell
-1,sorry babe make 2keys felt day really u girl enjoy urselves see u gym next wk
-1,twitter let update phone sad since first red game season tomorrow
-1,go bedclass morning
1,look like really great time congratulation dude
-1,mcds sweet tea sweet tea
1,go eastwood mall get freakin signature go straight home
-1,would pack trip tomorrow 8am
-1,fuck suck want new moon ok ok alittle funny sister scream
-1,helloooooooo soooo busy try call yesterdaynothing big look cor
-1,go last substitute teach job school year
1,keeeepin dl
1,hey good job soll two l greeting germany
-1,wish could here ur big laker fan know wish could zap la feel left fair
-1,listen demi wanna talk him now
1,aaaw yaaaayyyyy good luck aweennn cross finger
1,9 harf hour rest relax
1,lol caught hooh level ball odds oh well mine anyway
